{
  "$schema": "https://json-schema.org/draft/2020-12/schema",
  "$id": "https://chaos.local/schema/interaction-runtime/1/chaos-command-session.schema.json",
  "title": "CHAOS Command Session",
  "description": "A resumable command execution session.",
  "type": "object",
  "additionalProperties": false,
  "properties": {
    "schemaVersion": {
      "type": "integer",
      "const": 1
    },
    "commandRunId": {
      "$ref": "#/$defs/id"
    },
    "sourceCommand": {
      "type": "string",
      "minLength": 1
    },
    "changeId": {
      "type": [
        "string",
        "null"
      ],
      "maxLength": 160
    },
    "adapter": {
      "type": "string",
      "enum": [
        "claude",
        "copilot",
        "unknown"
      ]
    },
    "state": {
      "type": "string",
      "enum": [
        "created",
        "running",
        "waiting-for-decision",
        "ready-to-resume",
        "resumed",
        "completed",
        "cancelled",
        "expired",
        "failed"
      ]
    },
    "requestedMode": {
      "type": [
        "string",
        "null"
      ],
      "enum": [
        "light",
        "standard",
        "strict",
        null
      ]
    },
    "activeDecisionIds": {
      "type": "array",
      "items": {
        "$ref": "#/$defs/id"
      }
    },
    "answeredDecisionIds": {
      "type": "array",
      "items": {
        "$ref": "#/$defs/id"
      }
    },
    "consumedDecisionIds": {
      "type": "array",
      "items": {
        "$ref": "#/$defs/id"
      }
    },
    "lastCompletedStep": {
      "type": [
        "string",
        "null"
      ]
    },
    "nextStep": {
      "type": [
        "string",
        "null"
      ]
    },
    "lockIds": {
      "type": "array",
      "items": {
        "$ref": "#/$defs/id"
      }
    },
    "resumeCapsulePath": {
      "type": [
        "string",
        "null"
      ],
      "maxLength": 500
    },
    "createdAt": {
      "$ref": "#/$defs/isoDateTime"
    },
    "lastSeenAt": {
      "$ref": "#/$defs/isoDateTime"
    },
    "expiresAt": {
      "type": [
        "string",
        "null"
      ],
      "format": "date-time"
    },
    "metadata": {
      "type": "object",
      "additionalProperties": true
    }
  },
  "required": [
    "schemaVersion",
    "commandRunId",
    "sourceCommand",
    "adapter",
    "state",
    "activeDecisionIds",
    "answeredDecisionIds",
    "consumedDecisionIds",
    "createdAt",
    "lastSeenAt"
  ],
  "$defs": {
    "confidence": {
      "type": "string",
      "enum": [
        "HIGH",
        "MEDIUM",
        "LOW"
      ]
    },
    "knowledgeType": {
      "type": "string",
      "enum": [
        "FACT",
        "INFERENCE",
        "ASSUMPTION",
        "UNKNOWN",
        "CONFLICT"
      ]
    },
    "isoDateTime": {
      "type": "string",
      "format": "date-time"
    },
    "id": {
      "type": "string",
      "minLength": 1,
      "maxLength": 160,
      "pattern": "^[A-Za-z0-9][A-Za-z0-9._:-]*$"
    },
    "path": {
      "type": "string",
      "minLength": 1,
      "maxLength": 500
    }
  }
}
